{
  "$schema": "../../schema/geometry.schema.json",
  "format": "arcs.geometry/1",
  "name": "Wide rectangular pipe",
  "units": "mm",
  "aperture": {
    "type": "rectangle",
    "width": 600,
    "height": 60
  },
  "mesh": {
    "max_panel_length": 5,
    "curve_tolerance": 0.05,
    "minimum_panels": 96,
    "corner_grading": 2,
    "integration_order": 4
  }
}
