{
  "format": "arcs.geometry/1",
  "name": "30 mm circular PEC pipe",
  "units": "mm",
  "aperture": {
    "type": "circle",
    "radius": 30
  },
  "interfaces": [],
  "regions": [
    {
      "name": "beam_region",
      "material": "vacuum"
    },
    {
      "name": "exterior",
      "material": "PEC"
    }
  ],
  "beam": [
    0.0,
    0.0
  ],
  "mesh": {
    "max_panel_length": 1.0,
    "curve_tolerance": 0.01,
    "corner_grading": 2.0,
    "integration_order": 4,
    "minimum_panels": 256
  },
  "beta": 1.0,
  "materials": {
    "vacuum": {
      "conductivity": 0.0,
      "mu_r": 1.0,
      "epsilon_r": 1.0,
      "relaxation_time": 0.0
    },
    "air": {
      "conductivity": 0.0,
      "mu_r": 1.0,
      "epsilon_r": 1.0,
      "relaxation_time": 0.0
    },
    "PEC": {
      "kind": "pec"
    },
    "Cu": {
      "conductivity": 58000000.0,
      "mu_r": 1.0,
      "epsilon_r": 1.0,
      "relaxation_time": 0.0
    },
    "Al": {
      "conductivity": 35000000.0,
      "mu_r": 1.0,
      "epsilon_r": 1.0,
      "relaxation_time": 0.0
    },
    "SS": {
      "conductivity": 1400000.0,
      "mu_r": 1.0,
      "epsilon_r": 1.0,
      "relaxation_time": 0.0
    },
    "NEG": {
      "conductivity": 200000.0,
      "mu_r": 1.0,
      "epsilon_r": 1.0,
      "relaxation_time": 0.0
    }
  }
}
